Date,Headline
2025-08-18,"TechCorp Inc. announces record quarterly earnings, exceeding all analyst expectations."
2025-08-21,"Market shows signs of slowing down; investors are cautious."
2025-08-22,"Breaking: Key supplier for TechCorp Inc. files for bankruptcy, supply chain risks emerge."
2025-08-26,"TechCorp Inc. successfully launches new AI product line to positive reviews."
2025-08-28,"Regulatory concerns mount as government announces probe into the tech sector."
2025-09-03,"TechCorp CEO presents a confident outlook at the annual investor conference."
2025-09-05,"Analyst upgrades TechCorp Inc. to 'Strong Buy' with a new price target of $200."
2025-09-08,"Profit-taking observed across the tech sector as market pulls back slightly."
2025-09-11,"TechCorp unveils stunning new flagship product, immediate positive buzz online."
2025-09-17,"Competitor's disappointing earnings report casts shadow over entire industry."
2025-09-19,"Reports of unexpected production delays for TechCorp's new product surface."
2025-09-25,"Broader market sentiment turns negative on inflation fears."
2025-09-30,"TechCorp announces strategic partnership with leading European telecom company."
2025-10-07,"Major investment firm doubles its stake in TechCorp, citing long-term growth."
2025-10-09,"TechCorp's new AI division hailed as 'revolutionary' in a major tech journal review."
2025-10-15,"Company announces ambitious share buyback program, signaling confidence."
2025-10-21,"Macroeconomic concerns lead to widespread sell-off in growth stocks."
2025-10-29,"Rumors of a potential acquisition target for TechCorp are currently unsubstantiated."
2025-11-04,"TechCorp smashes quarterly revenue and profit forecasts; stock soars in after-hours."
2025-11-07,"Market jitters increase as Fed signals potential interest rate hikes."
2025-11-12,"Concerns raised over TechCorp's Q4 production targets due to supply chain issues."
2025-11-19,"Rival firm announces aggressive pricing strategy for competing product line."
2025-11-25,"TechCorp announces successful beta test results for its next-gen software."
2025-12-02,"Holiday sales forecasts for TechCorp products are exceptionally strong, analysts say."
2025-12-10,"TechCorp wins major government contract for its cloud services division."
2025-12-19,"Year-end 'Santa Claus rally' lifts the entire tech market."
2025-12-31,"TechCorp finishes the year as one of the top performers in the S&P 500."
2026-01-06,"Profit-taking hits tech stocks after a strong December performance."
2026-01-14,"Analyst downgrades TechCorp from 'Buy' to 'Hold' citing high valuation."
2026-01-22,"TechCorp to present at the Global Tech Symposium next month."
2026-01-28,"Company faces criticism over a minor data breach, promises security overhaul."
2026-02-06,"TechCorp stock consolidates after strong January gains, analysts watch for next catalyst."
2026-02-19,"Market sentiment remains neutral as investors await inflation data."
2026-02-23,"Global supply chain issues resurface, impacting the entire tech sector."
2026-03-03,"Fear grips the market as geopolitical tensions escalate, leading to a broad sell-off."
2026-03-17,"TechCorp shows resilience in a down market, attracting defensive investors."
2026-03-26,"Leaked documents reveal impressive specs for TechCorp's upcoming 'Phoenix' project."
2026-04-02,"TechCorp officially announces Phoenix Project, set for a Q3 launch, sparking investor excitement."
2026-04-09,"Multiple analysts initiate 'Buy' ratings following Phoenix Project announcement."
2026-04-23,"Pre-order numbers for 'Phoenix' are tracking well ahead of internal targets."
2026-05-07,"TechCorp acquires AI startup 'Cognito' in a $500M deal to bolster its AI division."
2026-05-14,"The acquisition of Cognito is seen as a major strategic win by industry experts."
2026-05-22,"TechCorp hits a new all-time high as positive momentum continues."
2026-06-04,"Company's ESG rating improves following new sustainability initiatives."
2026-06-17,"Analysts debate TechCorp's new, higher valuation; some warn of a potential pullback."
2026-06-29,"The summer lull sees lower trading volumes across the market."
2026-07-08,"TechCorp confirms its attendance at the annual developer conference, promises surprises."
2026-07-16,"Anticipation builds for TechCorp's Q2 earnings report next week; expectations are high."
2026-07-28,"A stronger-than-expected GDP report boosts overall market confidence."